"IDNota";"Titulo";"Nota"
243;"¿ Porqué la canela es una especia muy utilizada en repostrería?";"La canela se utiliza como preservante, pues previene que las sustancias grasas se vuelvan rancias."
245;"¿Qué se puede hacer cuando se corta la crema chantilly?";"Para recuperar la crema chantilly que se ha cortado hay que añadirle un poco de agua y continuar batiendo hasta que quede dura y aprovechable nuevamente. También se le puede espolvorear una cuchara sopera al ras de fécula de maíz y revolver enérgicamente."
246;"¿Cómo conservar la fruta seca, ya pelada?";"Los frutos secos pelados se conservan refrigerados hasta 6 meses y congelados hasta 1 año."
247;"¿Cuándo se usa el vermuth en repostería?";"El vermuth es un excelente sustituto del ron o el coñac cuando se trata de darle un toque de alcohol a una torta o tarta dulce."
248;"¿Cuál es la bebida apropiada para acompañar un plato de pescado?";"El vino blanco bien frío es la bebida ideal para acompañar un plato de pescado."
249;"¿Qué hay que tener en cuenta cuando se van a utilizar endibias?";"Las endibias nunca se deben remojar ni lavar, sino que se enjuagan levemente, pues sino se tornan amargas."
250;"¿Qué hierba es apropiada para el salmón?";"El eneldo es una hierba ideal para saborizar el salmón."
251;"¿Puede aprovecharse la cabeza del pescado fresco?";"Claro. Si no va a hornear los pescados enteros, use sus cabezas para hacer exquisitas sopas."
252;"¿Qué conviene saber para cocinar pavo o pechuga de pollo?";"El pavo y la pechuga de pollo horneados o asados resultan más jugosos y sabrosos si se pincelan con pesto antes de la cocción."
253;"¿Cómo se pueden utilizar las cebollas rojas?";"Las cebollas rojas son excelentes para ensaladas, pues tienen una textura más crujiente y sabor más suave que las otras variedades."
254;"¿Sólo se utilizan para flambear bebidas de alto contenido alcohólico?";"Es posible utilizar, también, bebidas de bajo contenido alcohólico, como la cerveza y el vino, siempre que la preparación que se va ha flambear esté a temperatura muy alta."
255;"¿Cómo retirar el cabito de la frutilla /fresa sin dañarla?";"Para no dañar las frutillas, los cabitos se retiran con una pinza de depilar."
256;"¿Qué hay que tener en cuenta cuando se maceran frutillas/fresas?";"Las frutillas/fresas se maceran enteras y se cortan después de terminado ese proceso, si la receta."
257;"¿Cuál es la mejor forma de cocinar el pato?";"El pato se cocina mejor al horno, pues reduce la grasa."
258;"¿Es posible recuperar una mermelada enmohecida?";"Por supuesto. Si la mermelada se ha enmohecido en su superficie se la puede volver a utilizar sin problemas. Para eso hay que quitarle cuidadosamente el moho con una cuchara y ponerla a hervir de nuevo, añadiéndole un poco más azúcar y espumándola."
259;"¿Cómo se distingue entre una levadura fresca y otra que no lo es?";"Una levadura está en buen estado cuando tiene un color gris tiza. Esto habla de su frescura. Para conservarla por más tiempo y evitar que se humedezca, guárdela dentro de un frasco opaco, tapado herméticamente en la heladera."
260;"¿Para que sirven las cáscaras de papa?";"Las cáscaras de papa secas son excelentes para encender fuego."
261;"¿A qué temperatura deben estar los quesos para ser consumidos?";"Para apreciar plenamente el sabor los quesos, para ser consumidos, deben estar a temperatura."
262;"¿Cómo mejorar una salsa aceitosa?";"Para mejorar una salsa aceitosa, basta añadirle unas gotitas de agua."
263;"¿Qué hacer si el puré de papas quedó muy salado?";"Si saló exageradamente el puré de papas, corríjalo agregándole un poco de azúcar."
264;"¿Cómo dorar cebollas en segundos?";"Las cebollas se doran más rápido si a la fritura se le agrega una pizca de pimentón dulce."
265;"¿Cómo desmoldar las gelatinas?";"Para que desmoldar gelatinas sea una tarea exitosa presione primero los bordes del molde con los dedos y luego páselo por agua caliente. Desmolde inmediatamente sobre un plato o fuente previamente mojada y escurrida."
266;"¿Cuál es el mejor chocolate para repostería?";"El chocolate ideal para repostería debe ser amargo y no contener menos del 50 por ciento de cacao. Los mejores suelen contener un 70 por ciento y aún más."
268;"¿Cómo utilizar los pétalos de rosa?";"Los pétalos de rosa son ideales para decorar platos principales, o postres, por ej. los flanes o las natillas se adornan con pétalos de rosa remojados en leche."
269;"¿Las endibias se pueden cocer?";"Las endibias son muy sabrosas asadas en la parrilla, rociadas con limón y salpimentadas."
270;"¿Qué hay que saber para cocinar bien las legumbres?";"Al cocinar legumbres es muy importante que mantenga la olla tapada, para que no salga el vapor y los granos se vayan cocinando en su propia humedad, sin requerir mucha agua."
271;"¿Cómo dar vuelta una tortilla con éxito?";"Para que las tortillas u omelettes no se peguen y puedan fácilmente darse vuelta es imprescindible no lavar nunca la sartén. Para mantenerla limpia, pásele un papel absorbente cuando aún esté caliente, para quitarle los restos de preparación, a menos que sea una sartén con algún revestimiento especial que requiera otro cuidado."
272;"¿Cómo obtener tortillas perfectas?";"Para que las tortillas y omelettes se doren bien pero a la vez resulten tiernas en su interior conviene cocinarlas a fuego fuerte."
273;"¿Qué hay que hacer para evitar que las claras a nieve pierdan volumen?";"Cuando la preparación lleva claras batidas a nieve lo mejor es agregarlas de a poco e ir mezclando suavemente con espátula, de forma envolvente. Así mantienen su volumen y le dan ligereza a la preparacion principal."
274;"¿Cómo hacer para que la olla no se ponga negra cuando se hierven papas?";"Para que la olla no se oscurezca durante la cocción de las papas, ponga en el agua un chorrito de aceite o unas hojas de coliflor."
275;"¿Cómo obtener ñoquis más livianos?";"Para que la masa de los ñoquis resulte liviana y no absorba mucha harina, hierva las papas con poca cantidad de agua, de modo que apenas queden cubiertas. El puré debe resultar seco."
276;"¿Cuál es el secreto de unos buenos ñoquis?";"La clave para que la salsa se impregne bien a los ñoquis consiste en tomar cada ñoqui y presionarlo contra los dientes de un tenedor grande, dejándolo luego caer sobre una tabla con un poco de harina. El acanalado que queda impreso en la pasta ayudará a compactarla y hará que la salsa se adhiera mejor."
278;"¿Las omelettes pueden hacerse en cualquier sartén?";"No. Lo ideal al momento de preparar tortillas u omelettes es contar con una sartén de fondo liso que sólo se utilice para ese fin."
279;"¿Cómo se puede disminuir la cantidad de huevos que lleva una tortilla, omellette o relleno?";"Para disminuir la cantidad de huevos de una tortilla o relleno cada huevo omitido se reemplaza por una cucharada de agua y una cucharadita de harina ligeramente batidas."
280;"¿Cómo dar un toque diferente a las carnes rebozadas?";"La carne o pescado rebozado en pan rallado tiene un gusto especial si se mezcla previamente con queso rallado, especias o hierbas."
281;"¿El aceite de fritura puede volverse a usar?";"Sí, siempre y cuando no se haya quemado y se tome la precaución de colarlo para quitarle impurezas y restos. Al aceite de la fritura de pescados, en cambio, conviene desecharlo porque queda impregnado de sabor y olor."
282;"¿Cómo aumentar el volumen de un relleno con carne picada?";"Los rellenos con carne picada crecen en cantidad si se les agrega una papa cocida rallada o hecha puré por cada 300 gramos de relleno."
283;"¿Cómo se hacen las bananas a la parrilla?";"Las bananas se asan a la parrilla con cáscara, girándolas, en unos 6 a 8 min.."
284;"¿Cómo obtener rápidamente crema chantilly?";"Para hacer más rápido la crema chantilly se recomienda batirla en un bol que se ha colocado dentro de otro, cubierto con cubitos de hielo."
285;"¿Cómo hacer para que las aceitunas negras brillen más?";"Lo ideal para que las aceitunas negras luzcan bien brillantes es pasarlas levemente por aceite."
286;"¿Cuál es la forma ideal de guardar el chocolate?";"El chocolate se debe guardar bien envuelto, refrigerado a unos 15° C."
287;"¿Cómo lograr una charlotte más espesa?";"Para lograr una charlotte más espesa disuelva en la leche o agua 1 cucharadita de fécula de maíz."
288;"¿Es posible sustituir el chocolate en la salsa de chocolate?";"Es posible reemplazar el chocolate de taza, como ingrediente en la salsa de chocolate, por 80 g. de cacao y 100 g. de azúcar, cada 100 g. de chocolate."
289;"¿Cómo se desfleman las cebollas?";"Para desflemar cebollas hay que cortarlas en rebanadas finas, pasarlas por agua hirviendo y luego por fría."
290;"¿Qué hay que tener en cuenta cuando se va a servir vino tinto?";"Es aconsejable abrir las botellas de vino tinto de 1/2 a 1 h. antes de servirlos."
291;"¿Cuál es la temperatura ideal para cocinar merengue?";"Lo mejor para que los merengues no fracasen es cocinarlos a horno moderado a bajo."
292;"¿Cómo lograr merengues más crocantes?";"Si quiere que los merengues se agrieten y resulten más crocantes, espolvoréelos con azúcar antes de llevarlos al horno. De lo contrario resultarán lisos."
293;"¿Cuánto tiempo se conserva el caldo de pollo?";"El caldo de pollo se conserva refrigerado, en recipiente tapado, hasta 3 días y congelado hasta 6 meses."
294;"¿ Existen marinadas para carnes en seco?";"La mezcla de canela, la pimienta, el jengibre y el clavo de olor, molidos, resultan excelente para marinar, en seco, carnes."
295;"¿Cómo se logra que las salsas de tomate resulten espesas?";"Para obtener salsas de tomate espesas sólo debe emplearse la pulpa de esa verdura"
296;"¿Cuál es la equivalencia para reemplazar tomates en conserva por frescos?";"Un kilo de tomates frescos equivale a 852 grs. de tomates enteros en conserva."
297;"¿En qué momento agregar la carne en caldos y pucheros?";"Si se quiere obtener un excelente caldo de carne, ésta debe colocarse en agua fría. Si lo que pretende es hacer un buen puchero, es preferible añadir la carne cuando el agua ya esté hirviendo."
298;"¿Como hacer para que la pasta al dente no se pase?";"Una vez que la pasta está cocida, antes de escurrirla, es aconsejable verter un chorro de agua fría, para que no se pase."
299;"¿Cómo se obtiene el hielo triturado?";"Coloque los cubitos de hielo dentro de un paño limpio, luego ciérrelo bien y golpéelos con un palo de amasar. Abra el paño y utilice el hielo triturado."
301;"¿Cuál es la mejor variedad de cebolla, para freír?";"Por su bajo contenido de líquido las cebollas rojas son especiales para hacerlas fritas, pues quedan crocantes."
302;"¿Se puede conservar el arroz cocido?";"El arroz cocido se conserva en la heladera hasta 4 días en un recipiente herméticamente tapado"
303;"¿Cómo se escarcha un vaso o copa?";"Se humedecen los bordes con agua o jugo de frutas y se sumerje en azúcar molida."
304;"¿Cuál es la mejor grasa/manteca?";"La mejor grasa/manteca es la elaborada con el tejido adiposo que rodea los riñones vacunos o porcinos."
305;"¿Qué cantidad de aceite usar para freir el pescado?";"Conviene utilizar poco aceite. Esta precaución, sumada a la de cuidar que el fuego sea mediano, garantizarán que el pescado se cocine bien por dentro y no quede grasoso."
306;"¿Qué calamares elegir?";"A la hora de comprar calamares recuerde que los más pequeños son los mejores y los más tiernos."
307;"¿Qué hay que saber cuando se cortan tiras de calamar?";"Para hacer tiras de calamar hay que cortarlo en forma transversal, para que no se arrollen."
308;"¿Cómo se preparan correctamente las berenjenas?";"Antes de utilizar las berenjenas se recomienda colocarles sal gruesa y ponerlas en un colador con un peso encima (un plato por ejemplo) para que drenen líquido. Luego se las debe lavar y secar con un trapo, así se les quita su sabor amargo. Recuerde que las berenjenas crudas son muy indigestas."
309;"¿Qué hacer para que el repollo sea más digestivo?";"Para que el repollo crudo no le haga mal y pueda digerirlo fácilmente, antes de cortarlo, déjelo en agua fría con sal durante media hora."
310;"¿Se puede congelar el repollo?";"Sólo una vez cocido, nunca crudo."
311;"¿Cómo incorporar claras batidas a nieve a otra preparación?";"Siempre hay que incorporar las claras batidas a nieve al ingrediente o preparación más pesada, para que no se pierda la consistencia espumosa."
312;"¿Cómo moldear el arroz sin que se desmorone?";"Para hacer timbales o moldes de arroz, humedecer apenas el molde y colocar dentro el arroz bien cocido, caliente. Presionar con el revés de una cuchara y desmoldar. Quedarán perfectos."
313;"¿Que se hace cuando el arroz queda sin líquido durante la cocción?";"Si el arroz se seca completamente y no está cocido, hay que agregarle agua caliente y remover los granos, con un tenedor, para que se suelten."
314;"¿Cuál es la mejor variedad de banana/plátano/guineo?";"Las que, si se les pasa la mano, están firmes y lucen un buen color amarillo, eventualmente veteadas de marrón. Se conservan a temperatura ambiente y pueden asarse o freirse. Cocidas son más digestivas."
315;"¿Cómo se disuelve la gelatina?";"Para disolver la gelatina, siempre hay que agregar ésta al líquido y nunca al revés."
316;"¿Qué hay que tener en cuenta cuando se van a utilizar mejillones?";"Se deben descartar los mejillones que están abiertos antes de someterlos a cocción y después de ésta, los que permanecen cerrados, pues en ambos casos no son aptos para el consumo"
317;"¿Se le puede quitar el olor a humedad a la harina?";"Claro. Para sacarle ese desagradable olor esparza la harina en una fuente y séquela a horno abierto, a temperatura baja, revolviendo siempre para evitar que se dore. Déjala enfriar y guárdela en un recipiente herméticamente cerrado."
318;"¿Se deben revolver los fideos durante la cocción?";"Los fideos no deben revolverse durante la cocción porque sino se pegan entre sí."
319;"Cuál es el momento apropiado para agregar sal al agua de cocción de las pastas?";"La sal se añade, al agua de cocción, conjuntamente con las pastas."
320;"¿Cómo se utilizan los fideos de arroz?";"Los fideos de arroz se utilizan fritos o se agregan a salsas, remojados previamente en agua tibia."
321;"¿Cómo saber la pureza del aceite?";"Para saber la pureza de aceite hay que verter dos cucharadas en un vaso y añadir dos gotas de agua oxigenada. Si el aceite es de oliva puro se torna de color verde, si es de semilla, rosa y si es de maní/cacahuete, grisáceo."
322;"¿Cómo se calcula la cocción del pollo?";"Por cada 450 gramos de pollo deberá estimarse su cocción al horno durante unos veinte minutos, a fuego medio/alto, y calcular un plus de 20 minutos más, por el total de la carne."
323;"¿Cómo se puede agilizar la cocción de las remolachas?";"Lo más práctico para cocinar rápidamente las remolachas es agregarle al agua de su cocción una pizca de azúcar."
324;"¿Cómo hacer que las remolachas mantengan intacto su color?";"Para que las remolachas no pierdan su color al cocinarse es importante no pelarlas ni pincharlas durante su cocción. También conviene dejarles un pedazo de su tallo y sólo desecharlo una vez cocidas."
325;"¿Qué repollo elegir?";"Tome dos repollos del mismo tamaño, coloque uno en cada mano, y quédese con el más pesado."
326;"¿Cómo se comprueba la frescura de las chauchas?";"Para comprobar si las chauchas o judías están frescas, dóblelas por la mitad. Si se parten es sinónimo de frescura, si no significa que se cosecharon demasiado tarde o estuvieron almacenadas durante mucho tiempo."
327;"¿Cuál es el poder endulzante de la miel?";"La miel tiene más poder endulzante que el azúcar, por lo cual se debe utilizar en cantidades menores que ésta."
328;"¿Con lograr cebollas rehogadas más gustosas?";"Para que las cebollas tengan mejor sabor, rehóguelas en manteca y unas gotas de vermut. Quedarán mucho más sabrosas."
329;"¿Qué hay que saber al momento de hervir verduras de hoja?";"Todas las verduras de hojas rinden más si se las cocina sólo con el agua que ha quedado en sus hojas luego de lavarlas, en una olla tapada sobre el fuego medio y por no más de seis o siete minutos. Una vez cocidas, escúrralas enseguida."
330;"¿Qué condimentos resaltan el sabor de las ensaladas verdes?";"Las ensaladas verdes logran un mejor sabor cuando al aliño se le agrega una cucharadita de orégano y uno o dos dientes de ajo picado. Esta preparación deberá mezclarse bien antes de ser añadida a la ensalada."
331;"¿Cómo hacer jugo de ajos?";"Para extraer el zumo de los ajos se los coloca, sin pelar, en un prensajos y se presiona hasta que caigan gotas"
332;"¿Qué hay que saber cuando se va a utilizar alcaparras conservadas en sal?";"Las alcaparras saladas se deben enjuagar antes de utilizar."
333;"¿Cómo se utiliza la escarola?";"La escarola se utiliza cruda o cocida."
334;"¿Por qué el bicarbonato de sodio es un ingrediente del dulce de leche?";"Cuando se prepara dulce de leche elbicarbonato de sodio evita que la leche se corte al hervir y, además le da mejor sabor."
335;"¿Cómo lograr un dulce de leche tentador?";"Para que el dulce de leche mejore su color y sea irresistible hay que añadirle apenas un poquito de bicarbonato, ya que el exceso lo oscurece y le hace perder encanto."
336;"¿Cómo obtener carnes bien gustosas?";"Para que una vez cocidas las carnes rojas no tengan gusto y aspecto de hervidas hay que descongelarlas antes de iniciar la cocción. De esta forma el resultado será óptimo."
337;"¿Cómo impedir que las papas peladas se oxiden?";"Si necesita reservar papas peladas porque las utilizará horas más tarde, colóquelas en un recipiente con agua y dentro de la heladera. Así evitará que se ennegrezcan por el contacto con el aire."
338;"¿Cómo hacer para retirar fácilmente la piel a los pimientos/morrones?";"Para retirar fácilmente la piel a los pimientos, una vez que se retiran del horno o del microondas colóquelos en una bolsa de plástico, cerrándola y, cuando se enfrían, se puede quitar la piel fácilmente."
339;"¿Cómo dorar cebolla rápidamente?";"La forma más rápida de dorar cebolla es agregarle pimentón dulce en la fritura."
340;"¿Cuál es la clave para amasar con levadura?";"El mejor aliado de las preparaciones con levadura es el agua de lluvia. Si la utiliza tibia logrará que sus masas crezcan extraordinariamente."
341;"¿Cómo asar morrones de una forma rápida?";"Si quiere asar morrones sin demoras, pínchelos con un tenedor de mango largo, póngalos sobre la llama del gas y déles la vuelta lentamente hasta que la piel quede chamuscada."
342;"¿Cómo lograr frituras livianas?";"Para que los churros, croquetas y buñuelos absorban menos aceite y queden más livianos hay que agregarle a la masa un poco de vinagre."
343;"¿Qué hay que saber al momento de hervir cebollas?";"Es importante tener en cuenta que las cebollas enteras pierden sus propiedades nutritivas cuando se las hierve peladas."
344;"Se puede congelar el repollo?";"Sólo una vez cocido, nunca crudo"
345;"¿Qué es el glutamato de sodio?";"El glutamato de sodio es una sal vegetal que se utiliza como condimento pues resalta los aromas y sabores de otros ingredientes."
346;"¿Cómo hacer omelettes más livianas?";"Lo más práctico para que las tortillas y omelettes no resulten aceitosas es cocerlas con poca manteca o aceite. Para eso, controle que el piso de la sartén tenga una película fina de materia grasa."
348;"Cómo se hacen las bananas a la parrilla?";"Las bananas se asan a la parrilla con cáscara, girándolas, en unos 6 a 8 min.."
349;"¿La canela se utiliza sólo en preparaciones dulce?";"La canela, además de ser ideal para sazonar cremas, flanes, natillas es apropiada para platos de carne de cordero, pato y caza."
350;"¿Qué elementos y utensilios son aptos para microondas?";"Los elementos auxiliares que pueden ser introducidos en el microondas son el papel absorbente o tissue, las servilletas de papel, el papel film adherente, las bolsas de cocción al horno o de freezer, los palillos o brochette de madera, el papel manteca, el hilo de algodón, y las cucharas o vajilla de madera."
351;"¿Cómo evitar que la mezcla se rebalse en la cocción?";"Lo más práctico para impedir que la preparación de tortas y bizcochos se derrame durante su cocción es llenar el molde un dedo menos de su borde."
352;"¿Cómo recuperar zanahorias que se han deshidratado?";"Si las zanahorias guardadas en la heladera lucen arrugadas por fuera pero firmes por dentro es porque se han deshidratado. En ese caso, córteles la unión con el tallo al ras y déjelas un rato sumergidas en agua fría para que se rehidraten."
353;"¿Cómo acentuar el dorado de las carnes?";"Si desea que la carne tenga un dorado más intenso cocínela en el microondas y termine su cocción en el grill de la cocina convencional."
354;"¿Cómo cortar fácilmente la piña/ ananá?";"Lo más práctico es cortar primero la fruta en rodajas y quitarle luego la cáscara de que las bordea."
355;"¿Cómo adaptar los tiempos de cocción tradicionales al microondas?";"Lo recomendable es reducir los tiempos de cocción tradicionales a la cuarta o mitad de tiempo, de acuerdo con las características de cada ingrediente. En términos generales, un kilo de comida requiere 18 minutos de cocción en microondas."
356;"¿A que temperatura deben estar los huevos para hervirlos?";"Los huevos deben estar unos 30 min. a temperatura ambiente, pues el agua caliente los cuartea."
357;"¿Cómo hacer para que la pasta al dente no se pase?";"Una vez que la pasta está cocida, antes de escurrirla, es aconsejable verter un chorro de agua fría, para que no se pase."
358;"¿Qué hacer para que no se pudra una cebolla abierta?";"Si va a utilizar sólo media cebolla, reserve la mitad que tiene la raíz, pues es la que no se deteriora tan rápido. Así evitará que la parte sin usar deba descartarse enseguida."
359;"¿Existen diferencias nutricionales entre los diferentes colores de morrones?";"Los morrones o pimientos rojos contienen el doble de vitaminas A y C que los verdes."
360;"¿Qué remolachas elegir?";"Al momento de comprar, opte por las remolachas que tengan sus hojas frescas y tiernas, para aprovecharlas también en las preparaciones."
361;"¿Cómo seleccionar buenos limones?";"El limón es de buena calidad cuando la piel es lisa, brillante y tiene poros pequeños. Además, debe ser pesado en relación a su tamaño, pues sino no será jugoso."
362;"¿En qué momento se adoba el cordero?";"A la hora de adobar cordero que luego será asado, lo mejor es untar bien la carne del animal con el adobo y dejarla descansar toda una noche (o, al menos, un par de horas) en la heladera antes de comenzar su cocción."
363;"¿Resulta indistinto lavar o cortar las verduras primero?";"Las verduras se lavan primero y luego se cortan, para que no pierdan nutrientes."
364;"¿Qué hay que saber para cocinar bien los garbanzos?";"Todas las legumbres se ponen a cocer con el agua fría, menos los garbanzos, que deben ponerse con agua caliente. Una vez que empieza la cocción no es recomendable añadirles agua fría u otros elementos que enfríen la cocción, porque quedarán crudos."
365;"¿Cómo elegir la espinaca?";"Las plantas de hojas pequeñas, de color verde oscuro, firmes y que no comenzaron a florecer son las más sabrosas. Recuérdelo al momento de seleccionarlas."
366;"¿Conviene salar los alimentos que se cocinan en el microondas?";"No. Se desaconseja salar previamente las carnes, aves y vegetales que se cocinarán en microondas, porque ésta los endurece. Los platos ya elaborados y cocidos, en cambio, pueden ser sazonados antes de ser calentados allí."
367;"¿Cómo hacer para que el tofu dure más tiempo en la heladera?";"Coloque los trozos de tofu en un recipiente hondo y cúbralos totalmente con agua fría. Tape el recipiente y guárdelo cambiando el agua todos los días."
368;"¿Cuál es el vino ideal para perfumar caldos?";"¿Cuál es el vino ideal para perfumar caldos?Para perfumar un caldo o consomé a base de vino debe usarse uno bueno, de preferencia jerez, y echarlo antes de servir la sopa, para que no pierda el aroma."
369;"¿Cómo lograr que el ajo sea digerible?";"Para que el ajo sea digerible se debe retirar antes de utilizarlo, el brote verde interior."
370;"¿Cómo conservar frambuesas?";"Las frambuesas se conservan, en su propio almíbar, congeladas por 6 meses y refirgeradas 4 días, para prepararlas hay que colocarlas con azúcar,la mitad de su peso, y un poco de limón."
371;"¿Cómo hacer salsa de frambuesa rápidamente?";"Para lograr una tentadora salsa de frambuesa hay que diluir medio frasco de mermelada de esta fruta en 1/3 de taza de agua mineral y calentar la preparación a fuego medio/alto, mezclando, unos 4 min. Luego, colar y servir fría."
372;"¿Cómo quitarse la resaca?";"Tome un limón fresco y córtelo en rodajas y si tuviera un limonero cerca tome también algunas hojas. En una cacerola pequeña con 2 tazas de agua lleve la preparación al fuego y déjela hervir durante 10 minutos. Luego tómela tibia."
373;"¿Cuál es el tamaño de copa más apropiado para el vino?";"La copa ideal para servir vino es la de agua, en una copa de tamaño más grande su aroma se dispersará rápidamente."
374;"¿Cómo realzar el color de la remolacha?";"Si quiere acentuar el tono rojo de la remolacha vierta en el agua de su cocción dos o tres cucharadas soperas de vinagre. Con este mismo propósito, déjele dos o tres centímetros de su tallo, para que no pierda pigmentación."
