"IDNota";"Titulo";"Nota"
375;"¿Cómo manipular correctamente el pescado fresco?";"Para poder manipular un pescado resbaladizo, que es un rasgo de frescura y no de mala calidad, enjuáguelo bien con agua caliente o con agua y vinagre antes de quitarle las escamas. Así, podrá ""dominarlo"" sin inconvenientes"
376;"¿Cómo se cocinan los caracoles?";"A los buccinos o caracoles de mar conviene cocinarlos enteros, porque la carne es difícil de extraer cuando todavía están vivos. Para esto, hierva brevemente un caldo y eche en él a los buccinos, cocinándolos hasta que la masa esté compacta pero tierna. Luego retire la carne con un tenedor y límpielos si les quedó algo de arena."
377;"¿Para que sirven las cáscaras y valvas de los mariscos?";"Las cáscaras y valvas de los mariscos son excelentes para saborizar caldos"
378;"¿En qué momento es conveniente picar el perejil?";"El perejil se debe picar en el momento de utlizar, porque es muy rico en vitamina C, que se pierde con el contacto con el aire, por esa razón tampoco es aconsejable congelarlo"
379;"¿Qué hay que tener en cuenta cuando se cuecen choclos?";"Los choclos deben someterse a un tiempo de cocción corto pues sino pierden jugo, se secan y tornan duros."
380;"¿Cómo lograr que el coco fresco no se oscurezca después de rallado?";"Para que el coco fresco rallado no se oscurezca hay que espolvorealo con azúcar antes de rallarlo."
381;"¿Cuál es la mejor forma de hervir hortalizas?";"Las hortalizas de raíz se cocinan en agua fría, las verdes en agua hirviendo."
382;"¿Cómo sacar la piel a las almendras?";"Para retirar la piel, tome un puñado de almendras y póngalas en la mano, cierre la palma y muévala, para que la palma frote las almendras constantemente. De este modo utilizando la fricción entre las pieles de las almendras, se irán pelando solas."
383;"¿Cómo debe conservarse la manteca?";"Para que la manteca no tome olor debe guardarse, refrigerada, bien envuelta o en recipiente hermético."
384;"¿Cómo se puede acelerar es proceso de maduración de la palta?";"Para acelerar la maduración de la palta hay que cubrirla totalmente en abundante harina común durante un día."
385;"¿Qué hay que hacer para que las frutillas/fresas queden siempre firmes?";"Para que las frutillas/fresas no queden acuosas y mantengan su firmeza original es importante enjuagarlas rápidamente con el rabito y sólo quitarlo después de este paso."
386;"¿Cómo sustituir el azúcar impalpable/glas/lustre?";"Si no se tiene azúcar impalpable es posible reemplazarlo colocando una taza de azúcar común en la licuadora y procesarlo por unos segundos o minutos, según la potencia de la máquina. Para evitar que este azúcar se humedezca se recomienda guardarlo en un frasco cerrado."
387;"¿Es posible recuperar la crema inglesa que se ha cortado?";"Sí. Aunque se haya cortado, es posible reaprovechar esta riquísima crema sacudiéndola enérgicamente hasta que quede lisa."
388;"¿Cómo saber cuándo está a punto la pera?";"Las peras de buena calidad tienen la piel firme, pero no dura. Si la piel es dura al tacto esto significa que la fruta fue cosechada antes de tiempo y que se pasará muy rápido, volviéndose arenosa y sin sabor. Por eso, conviene comerlas peladas. Recuerde el consejo popular: ""Pela la pera a tu amigo y la manzana a tu enemigo""."
389;"¿Cómo se prepara el caramelo para flanes?";"Para acaramelar bien la flanera coloque en el molde dos cucharadas de azúcar apenas humedecidas con agua. Lleve el recipiente al fuego hasta que el azúcar se derrita y tome color dorado, con cuidado de que no se queme. Deje enfriar antes de verter la preparación."
390;"¿Con qué se puede reemplazar el espárrago?";"Si no cuenta con espárragos disponibles, la parte blanca del puerro es un excelente sustituto de ese ingrediente. Recuérdelo al momento de hacer tartas, puré de verduras u omelettes."
391;"¿Qué hacer para que los espárragos resulten tiernos?";"La solución es sencilla: retire las fibras exteriores que recorren sus tallos con un pelapapas o un cuchillo filoso. Déjelos media hora en agua para que se hidraten, y luego acomódelos en una olla con agua, un poco de sal, una cucharada de jugo de limón y una de manteca o aceite. Hierva hasta que estén tiernos y sabrosos."
392;"¿Cómo acelerar el proceso de descongelamiento de la carne?";"La carne se descongela más rápidamente pasándola previamente por agua con vinagre."
393;"¿Cómo preparar la pera?";"La pera es una fruta muy versátil, se come cruda, cocida, deshidratada o confitada, es excelente en ensaladas mixtas y acompañando quesos."
394;"¿Cómo lograr que las empanadas horneadas no queden secas?";"Las empanadas no resultan secas si se precalienta el horno y se cocinan 15 min. en horno a temperatura bien caliente."
395;"¿Cómo lograr rellenos bien sabrosos?";"Para que el relleno de las empanadas que lleva carne quede más rico conviene hacerlo un día antes y conservarlo en la heladera hasta el momento de usar."
396;"¿Cuáles son las formas de cocción de la cocina naturista?";"Las formas de cocción preferidas por el naturismo son ""al dente"", ""al vapor"" y ""a la brasa"", pues son las que más preservan el estado original de los alimentos."
397;"¿Qué hay que saber para amasar con levadura?";"Para que estas masas leven bien no es necesario emplear demasiada levadura. Es más importante, en cambio, trabajar en un ambiente cálido, sin corrientes de aire."
398;"¿Cómo se deben guardar las hierbas y especias?";"Las hierbas secas y las especiasse deben guardare n lugares oscuros, secos y frescos pues se deterioran por acción del calor, la luz y la humedad."
399;"¿Cómo impedir la fermentación de las mermeladas?";"Lo más adecuado para evitar el proceso de fermentación es añadirles un gramo de ácido salicílico disuelto en un poco de agua. La proporción es válida por cada kilo de fruta empleada en la elaboración del dulce."
400;"¿Existen diferencias entre los tipos de aceitunas?";"Las aceitunas verdes contienen más grasas y calorías que las negras."
401;"¿Pará qué sirve la tinta de calamar?";"Es muy común utilizarla para dar sabor y color a la pasta y el arroz, para cocer los calamares en su propia tinta y hacer salsas o masa negra de pastas con o sin relleno. Es posible, aunque complicado, extraerla caseramente. También se la puede adquirir envasada en la pescadería."
402;"¿A qué temperatura deben estar los huevos para preparar una torta?";"Para que una torta quede esponjosa los huevos deben estar a temperatura ambiente, pues al batirlos levantan más volúmen"
403;"¿Cómo evitar el mal olor del coliflor mientras se cocina?";"Para que el coliflor no de olor se recomienda agregarle, al cocinarlo, un pedacito de pan, un poco de leche o un gajo de limón."
404;"¿Cómo obtener carnes bien doradas?";"Para lograr un dorado parejo, es conveniente dejar siempre un poco de grasa en ambos lados de la superficie de la carne, o pincelarlas con un poco aceite."
405;"¿Cómo se preparan las carnes que se cocinarán en microondas?";"Antes de iniciar la cocción se recomienda secar bien los trozos de carne con un papel absorbente, para retirarles toda la humedad que puedan contener. De otro modo, tomarán un aspecto deslucido y parecerán hervidas."
406;"¿Cómo se hacen correctamente los cortes en diagonal a la masa con levadura?";"Los cortes en diagonal se realizan con un cuchillo de buen filo, con mucha suavidad para no deformar la masa. Puede también emplearse hojas de afeitar, tijeras o cutters."
407;"¿Qué hay que saber antes de guardar un matambre relleno en el frezeer?";"Si desea congelar el matambre recuerde no colocarle huevo duro, ya que con el efecto del frío los huevos modifican su textura."
408;"¿Cómo hacer huevos revueltos más sabrosos?";"Los huevos revueltos resultan deliciosos si se le añada unas gotas de jerez en el batido."
409;"¿Cómo lograr que el pulpo resulte más tierno?";"El pulpo grande resulta más tierno si se sumerge en agua con limón por 1/2 h. antes de prepararlo."
410;"¿Es posible acortar el tiempo de cocción del pulpo?";"Colocando un corcho limpio en la salsa o líquido de cocción el tiempo de cocción del pulpo disminuye."
411;"¿Cómo retirar fácilmente la pulpa del coco?";"Para retirar la pulpa del coco, fácilmente, hay calientarlo en el horno antes de partirlo."
412;"¿Cómo calcular los huevos para una tortilla?";"Para hacer tortillas se calculan 3 huevos batidos por 2 tazas de otros ingredientes."
413;"¿Cómo se logran huevos fritos perfectos?";"La cocción de los huevos fritos debe ser a fuego lento para que salgan parejos. La llama muy fuerte los arrebata y la muy pequeña no logra dorar sus bordes."
414;"¿A qué temperatura se asan las carnes?";" La cantidad de calor que requieren las carnes para asarse está en relación a su tamaño. Cuanto más chicos son los trozos más caliente se necesita el horno y menos tiempo demora su cocción."
415;"¿Cómo evitar que los filetes de pescado fritos se rompan?";"Si no se los reboza con otra preparación los filetes de pescado se fríen rebozados en harina de trigo, así no se rompen y se doran rápidamente."
416;"¿Cómo evitar que las zanahorias se ablanden?";"Con el paso de los días, las zanahorias suelen ablandarse. Para conservarlas frescas durante más tiempo conviene ponerlas entre dos capas de arena."
417;"¿En qué se diferencian el vaso de whisky y el vaso old fashioned?";"El vaso de whisky y el vaso old fashioned son anchos pero el de whisky tiene entre 300 a 350 grs. de capacidad y el old fashioned entre 260 a 300 grs."
418;"¿Qué hay que saber al momento de cocinar alimentos húmedos?";"Los alimentos con mucha humedad se cocinan mejor y más rápido que los poco húmedos, por lo cual el tiempo de cocción debe ser menor."
419;"¿Cómo evitar la formación de cristales cuando se prepara helado casero, sin contar con una heladora?";"La gelatina sin sabor y las féculas evitan la formación de cristales en los helados, les dan mayor volumen y consistencia cremosa y suave."
420;"¿Cómo hacer que no cristalice el helado?";"1. Para que los helados no se descongelen rápidamente y pierdan su consistencia, hay que colocar en el freezer los platos o copas en los cuáles se van a servir.
2. Para que el helado cremoso, casero, no se cristalice la preparación debe contener una pequeña cantidad de gelatina sin sabor o claras batidas a nieve y una copita de aguardiente, vodka, cognac o grappa.
3. Para que el helado casero de fruta no se cristalice la preparación debe contener 500 grs de fruta y 250 cc de almíbar/jarabe.
4. La crema de leche/nata, leche o quesos blancos mejora la consistencia de los helados."
421;;"1. Para que los helados no se descongelen rápidamente y pierdan su consistencia, hay que colocar en el freezer los platos o copas en los cuáles se van a servir.
2. Para que el helado cremoso, casero, no se cristalice la preparación debe contener una pequeña cantidad de gelatina sin sabor o claras batidas a nieve y una copita de aguardiente, vodka, cognac o grappa.
3. Para que el helado casero de fruta no se cristalice la preparación debe contener 500 grs de fruta y 250 cc de almíbar/jarabe.
4. La crema de leche/nata, leche o quesos blancos mejora la consistencia de los helados."
