"IDNota";"Titulo";"Nota"
116;"¿Cómo sustituir el azúcar impalpable?";"Si no se tiene azúcar impalpable es posible reemplazarlo colocando una taza de azúcar común en la licuadora y procesarlo por unos segundos o minutos, según la potencia de la máquina. Para evitar que este azúcar se humedezca se recomienda guardarlo en un frasco cerrado."
117;"¿Cómo lograr que la cáscara del huevo no se rompa durante la cocción?";"Para que la cáscara no se cuartee durante la cocción, el huevo debe estar la temperatura ambiente."
118;"¿Se pueden conservar los champiñones?";"Los champiñones se deben consumir bien frescos, pero en la heladera se conservan hasta 4 días."
119;"¿Es posible suavizar el sabor del ajo?";"Una forma de suavizar el sabor del ajo es que envolverlo en papel absorbente, luego golpearlo y apretarlo."
120;"¿Cómo se puede mejorar el aspecto de las pasas de uva?";"Las pasas de uva mejoran su presentación si se las hidrata en una sustancia líquida durante 10 min."
122;"¿Puede aprovecharse el agua donde se hirvieron papas?";"Por supuesto. Puede utilizar un poco de esa agua de cocción para hacer puré, agregándole leche en polvo y manteca."
123;"¿Cómo se pueden tiernizar los bifes?";"Para que los bifes se vuelvan más tiernos conviene golpear su superficie con la ayuda de un palo de amasar o una masa de cocina. Los golpeteos ayudan a romper los tejidos conectivos de la carne y, por lo tanto, a quitarles rigidez."
124;"¿Cómo aprovechar al máximo el apio?";"Para un mejor aprovechamiento de la planta de apio, siga estos consejos: emplee las hojas en un caldo, las pencas en las comidas y su corazón en salsas y entradas frías."
125;"¿Hay que condimentar los alimentos que van al microondas?";"Sí. Para lograr platos sabrosos es imprescindible condimentar muy bien los ingredientes. Recuerde que como se acortan los tiempos de cocción, los alimentos poco condimentados tienen menos posibilidad de absorber las especias que haya elegido para realzar su sabor."
126;"¿Pueden aprovecharse las cáscaras de papa?";"Claro. Las cáscaras de papas orgánicas pueden utilizarse para preparar tortillas y omelettes, bien lavadas, cortadas en juliana y rociadas con jugo de limón. Use para ello cien gramos de cáscaras y rehóguelas junto a una cebolla picada en aceite. Luego agrégueles tres huevos batidos, condimentos y cocine la mezcla como cualquier otra tortilla."
127;"¿Cómo hornear las manzanas sin que se rompan?";"Para que las manzanas al horno no se rompan al cocerlas conviene hacerles un corte superficial en la cáscara o untarlas con aceite."
128;"¿Cuánto tiempo demora la cocción del cerdo?";"No se puede dar una respuesta exacta, porque depende de cada corte, pero recuerde que la carne de cerdo necesita un tiempo más prolongado que otras carnes para cocinarse. Siga de cerca la cocción, entonces, para evitar esperas innecesarias."
129;"¿Es necesario descongelar la carne someterla a cocción?";"Los bifes, las hamburguesas y las milanesas no necesitan descongelarse para cocinarlas."
130;"¿Qué precauciones hay que tomar con la carne picada?";"La carne picada debe consumirse rápidamente (no más de dos o tres días después de haber sido comprada), porque se descompone con facilidad y su ingesta en ese estado resulta peligrosa."
131;"¿Cuáles son los mejores cortes de carne porcina?";"La carne de cerdo más tierna es la del lomo, o espalda, de donde se extraen diferentes cortes."
132;"¿Cómo lograr que el arroz no cambie de color en su cocción?";"Si quiere que el arroz quede bien blanco agréguele al agua de su cocción una cucharada de vinagre de alcohol."
134;"¿Es posible hacer aceite picante en casa?";"Sí, para fabricar aceite picante casero hay que colocar en una botella de aceite un ají seco o fresco (pinchado con un escarbadientes) y dejar reposar un mes antes de utilizarlo."
135;"¿Cómo pueden aprovecharse los restos de pan?";"Si sobra pan, lo usual es convertirlo en pan rallado. Para eso conviene secar los restos en el horno y procesarlos de una taza a la vez, descortezándolos previamente. También se lo puede tostar y cortar luego en pequeños cubitos. En este caso, guárdelos en un frasco y empléelos como guarnición de sopas crema o ensaladas, rehogándolos previamente en aceite."
136;"¿Cuál es la forma más segura para condimentar un plato con chile?";"Para evitar un excesivo sabor picante es conveniente saltear en dos cucharadas de aceite mezcla un chile."
137;"¿Qué precauciones hay que tener cuando se utiliza jengibre fresco?";"Antes de rallar o picar o cortar el jengibre fresco, es necesario pelarlo y retirarle las fibras."
138;"¿Qué cantidad de pasta cruda se debe calcular por persona?";"Por persona se debe calcular de 50 a 60 gr. de pasta cruda."
139;"¿Qué cantidad de líquido se requiere para cocer la pasta?";"Para cocer la pasta de debe calcular 1 litro de líquido cada 100 g. de pasta."
140;"¿Qué hacer para que las empanadas no pierdan su relleno en el horno?";"Para evitar que las empanadas al horno se abran durante la cocción y derramen su relleno se recomienda pinchar uno de sus extremos con un tenedor o escarbadiente, antes de ponerlas a cocinar. Con esto se logra sacarles el aire del interior."
141;"¿Las hierbas frescas y las secas se diferencian en la utilización?";"Las hierbas frescas se utilizan en ensaladas y salsas, las secas son más apropiadas platos que requieren tiempos de cocción prolongados."
142;"¿Cómo picar más facilmente el perejil?";"Para picar el perejil con facilidad mójelo, previamente, con agua caliente."
143;"¿Dónde deben cocinarse los dulces?";"Lo recomendable es hacerlo en una cazuela de barro o enlozada, destapada. Cuando corresponda revolver, hacerlo con cuchara de madera."
145;"¿Cómo retirar la piel a la raíz de jengibre?";"El forma más fácil de pelar la raíz de jengibre es rasparla con el canto de una cuchara."
146;"¿Hay que pinchar la carne durante la cocción?";"Durante la cocción nunca debe pincharse la carne, para evitar la pérdida de jugos."
147;"¿Cómo puede aprovecharse todo el puerro?";"Cuando la receta solamente requiere la parte blanca o tierna del puerro, no deseche el resto pues la parte verde es perfecta para darle sabor a un caldo de verduras. Blanqueada, esta parte sirve también como ""lazo"" para cerrar panqueques o paquetitos de verdura."
148;"¿Qué hacer para que el aceite no salpique?";"Si no quiere que el aceite de la fritura salpique, coloque en la sartén u olla un poquito de sal."
149;"¿Es posible hornear pollo sin ensuciar el horno?";"Para no ensuciar el horno conviene cocer el pollo en una bolsa especial."
150;"¿Qué hay que tener en cuenta cuando va a asar carne?";"La carne para asar tiene que estar a temperatura ambiente."
151;"¿Cómo lograr carnes a la parrilla o plancha más sabrosas?";"La carne a la parilla o plancha tiene mejor sabor si se condimenta al finalizar la cocción."
152;"¿A que temperatura debe estar la cerveza, cuando se utiliza como ingrediente?";"La cerveza que se va a utilizar como ingrediente debe estar a temperatura ambiente."
153;"¿Qué hacer para que el caramelo del flan no se cristalice?";"Hay que echarle unas gotas de limón."
154;"¿Qué hacer cuando el chocolate cambia de color?";"Cuando el chocolate o los bombones tienen manchas blancuzcas en su superficie significa que han sido expuestos al calor excesivo. En ese caso, se los debe descartar por no ser aptos para su consumo."
156;"¿Cómo lograr aves crocantes y doradas?";"Para cocinar un ave entera es imprescindible lavarla y secarla muy bien antes de ponerla a cocer, ya que si le queda humedad no resultará crocante ni alcanzará a dorarse bien."
157;"¿Cómo se cocinan correctamente las presas de ave?";"Para cocinar presas de ave se debe precalentar la bandeja doradora ocho minutos a potencia máxima y luego distribuir las presas rodeando los bordes, con la parte más fina hacia el centro de la bandeja, para que la cocción resulte pareja."
158;"¿Cómo impedir que se seque la carne de ave?";"Para que durante la cocción la carne no se seque ni se salpique el interior delmicroondas conviene cubrir el ave o sus presas con papel manteca."
159;"¿Qué hacer para que las mermeladas no se cristalicen?";"Agregarles un poco de jugo de limón es el secreto ideal."
160;"¿Cómo flambear platos?";"Para flambear tortillas, panqueques o postres, caliente media taza tamaño té de cognac durante 30 segundos a nivel máximo. Luego retire, encienda y flambee."
161;"¿Qué hay que saber para conservar los duraznos frescos?";"El secreto para mantenerlos en buen estado es no lavarlos ni cepillarlos hasta el momento mismo de consumirlos. Tampoco es recomendable exponerlos a temperaturas elevadas. Guárdelos siempre en la heladera, dentro de un recipiente con tapa."
162;"¿Cómo hacer una compota ligth?";"Si quiere convertir una compota en un postre dietético, reemplace el azúcar por sacarina o edulcorante, pero recuerde endulzar una vez que la fruta se haya cocido."
163;"¿Cómo se limpian las pasas de uva?";"Para utilizar adecuadamente las pasas de uva es necesario enjuagarlas bien antes, quitarles el cabito y separar las semillas"
164;"¿En qué momento es conveniente agregar las especias, condimentos o hierbas?";"Las especias, los condimentos y las hierbas aromáticas conviene agregarlas al final de la cocción para preservar el aroma."
165;"¿Cómo se cocinan los alimentos con mucha agua?";"Recuerde que el agua atrae las microondas, por lo cual los alimentos acuosos o muy húmedos deben cocinarse sin añadir líquido. De lo contrario, hervirán."
166;"¿Puede hacerse cualquier receta en el microondas?";"Cualquier receta que implique alguno de los métodos tradicionales de cocción sale exacta si se siguen todos sus pasos, pero se adaptan, acortándolos, los tiempos de cocción."
167;"¿Qué especias llevan los ramitos aromáticos?";"Un ramito compuesto contiene generalmente laurel, orégano, perejil, tomillo, romero, apio y salvia."
168;"¿Se puede aromatizar el aceite?";"Sí, pero tenga en cuenta que para aromatizar el aceite que va a ser usado en frituras dulces o eliminar el sabor fuerte de un aceite no muy refinado, hay que freír previamente en éste una cáscara de limón o naranja."
169;"¿Qué hay que hacer para que las frutillas queden siempre firmes?";"Para que las frutillas no queden acuosas y mantengan su firmeza original es importante enjuagarlas rápidamente con el rabito y sólo quitarlo después de este paso."
170;"¿En que se diferencia la lima del limón?";"La lima contiene menos vitamina C que el limón y es excelente para acentúar el sabor de platos de pollo, porotos o judías y sopas de verduras."
171;"¿Se puede reemplazar la crema de leche?";"Para disminuir la ingestión de calorías la crema de leche se puede reemplazarpor queso crema, yoghourt o ricotta."
172;"¿Cómo hacer para que una salsa con vino no quede ácida?";"Si utiliza vino en las salsas es recomendable dejarlas hervir unos minutos, para que el alcohol se evapore y queden con un suave sabor frutado. De lo contrario resultarán ácidas."
173;"¿Cómo puede aumentarse el rendimiento de un huevo?";"Si el huevo es chico o insuficiente para la preparación que está elaborando, hágalo rendir más con sólo añadirle un poco de leche."
174;"¿Cómo impedir que el huevo duro se reseque?";"Para que las rodajas de huevo duro no se resequen es conveniente rociarlas con unas gotas de aceite, cubrirlas con papel celofán o polietileno bien adherido a los bordes y llevarlas a la heladera hasta el momento de servir."
175;"¿Qué precauciones tomar antes de usar conservas de pescado?";"Algunas conservas, como las de sardinas, atún y filetes de bonito, deben ser escurridas antes de su utilización. Para consumirlas sin problemas hay que descartar primero los restos de escamas y retirarles la espina dorsal."
176;"¿Qué hacer cuando se pega el caramelo a la olla?";"Lo mejor para quitar el caramelo a una olla o molde es ponerle un poco de agua y dejarla hervir."
177;"¿Cuál es el tiempo de cocción de la pasta fresca?";"El tiempo de cocción de la pasta fresca, una vez que se echa en agua hirviendo, es de 1-3 min., desde el líquido hierve nuevamente."
178;"¿Cuál es la forma apropiada para conservar el queso rallado?";"La mejor forma de conservar el queso rallado es guardarlo, dentro de una bolsita de polietileno, en la heladera."
179;"¿Cómo se logra el gusto del ""pan de campo""?";"Si desea cocinar un sabroso pan de campo, pincélelo con aceite de oliva antes y durante el horneado."
180;"¿Qué importancia tiene el agua que usamos para hacer pan?";"Muchísima. La ideal es la de lluvia, pero si usa la corriente controle que no tenga mucho cloro. Si es así, conviene usar agua mineral."
181;"¿Con qué se puede reemplazar la crema chantilly?";"Es posible obtener un excelente sustituto de la crema chantilly cortando en rodajas una banana madura y agregándole una clara y tres gotas de jugo de limón. Es muy importante batir enérgicamente esta preparación antes de usar."
182;"¿Cómo sustituir el chocolate amargo?";"El chocolate amargo se puede sustituir por 3 cucharadas de cacao, también amargo, mezclado con 1 1/2 cucharada de manteca derretida, esta pasta equivale a 30 g. de chocolate en barra."
183;"¿Cómo se reemplaza la albahaca fresca?";"Cuatro cucharaditas de albahaca seca molida equivalen a una cucharadita de la misma hierba fresca, picada."
184;"¿Es posible aumentar el volumen de la manteca/mantequilla o margarina?";"Es posible duplicar la cantidad de manteca/mantequilla o margarina para hacerlo hay que batirlas y simultáneamente ir incorporando leche, de a poco, hasta tener una mezcla homogénea."
185;"¿Cómo se calienta el pescado ya frito?";"Lo ideal para calentar pescado frito es ponerlo sobre un trozo de papel encerado, enrollando los bordes para que quede bien cerrado y colocarlo al horno, a la parrilla o en el microondas. Calentado de esta forma conserva todo su sabor."
186;"¿Cómo se conservan los pescados fritos?";"La clave de conservarlos perfectos es cubrirlos totalmente con aceite."
187;"¿Cómo deben lucir las anchoas para saber si están en buen estado?";"Sean en salmuera o en aceite, las anchoas en conserva deben tener un color rosado uniforme. Esto indica que pueden consumirse sin problemas. Si lucen un tono amarillento es porque están rancias y conviene desecharlas."
188;"¿Cómo hacer para que no se quemen los palitos de madera para brochettes?";"Si los palitos para brochettes son de madera le sugerimos que los coloque durante una media hora dentro de un recipiente con agua, de esta forma no se quemará la madera durante la cocción."
189;"¿Cómo evitar que los trozos de carne no se peguen a la broceta?";"Para que la carne no se pegue, aceite ligeramente la brocheta antes de ensartarla."
190;"¿Con qué especias se condimenta el cordero?";"El cordero se lleva bien con varias especias, pero sobre todo con el romero, el tomillo y la mejorana, que deben usarse preferentemente frescas. También con el ajo y el aceite de oliva."
191;"¿Qué hay que saber para cocinar un cordero?";"La carne de cordero se cocina más rápido que la carne vacuna. Se aconseja servirla bien caliente o fría, ya que tibia no es agradable al paladar."
192;"¿Cómo se conservan mejor las berenjenas?";"La tradición popular de la zona central de la Argentina encontró una forma original de conservar las berenjenas, haciendo chichoca o charque, dado que no es conveniente congelar estas verduras. La técnica consiste en cortar las berenjenas en rebanadas y agregarles mucha sal gruesa por ambos lados. Luego hay que ponerlas al sol, extendidas hasta que se sequen. Antes de utilizarlas en guisos y estofados conviene siempre remojarlas."
193;"¿Cómo se pelan los morrones?";"Para pelar morrones o pimientos rojos es aconsejable darles un rápido hervor y desprender enseguida la piel con las manos. Verá que fácil resulta hacerlo."
194;"¿Cómo se conservan los chiles?";"Para conservarlos durante un año se deben secar, triturar y guardar en un recipiente hermético en un lugar oscuro, seco y fresco."
195;"¿Cómo impedir que los langostinos se arqueen y doblen?";"Para mantener los langostinos rectos, introdúzcales un palillo antes de cocinarlos, en su centro. Esto evita que se curven durante la cocción. Recuerde retirar el sostén antes de llevarlos a la mesa."
196;"¿Cómo se calcula la cantidad de cebolla deshidratada que lleva una comida?";"Al momento de usar cebolla deshidratada en la preparación de un plato recuerde que una cucharada de las escamas resecadas es igual a media cebolla cruda."
198;"¿Cómo hacer huevos duros?";"El huevo cuece en agua fría, dejándolo no más de 12 min. desde que alcanza el punto de ebullición, pues sino la yema se torna verdosa."
199;"¿Cómo lograr que las especias molidas conserven más tiempo su aroma?";"Las especias molidas conservan su aroma por más tiempo si se las guarda en el freezer o congelador."
200;"¿Cuál es el secreto para lograr un buen cóctel?";"Hay que utilizar marcas de calidad y ser muy riguroso en la exactitud de las medidas."
201;"¿Cómo se utiliza el azúcar en la preparación de tragos?";"El azúcar debe disolverse en un poco de agua, antes de utilizarla en la preparación, pues no es soluble en alcohol."
202;"¿La cerveza reemplaza la levadura?";"La cerveza un perfecto sustituto de la levadura en buñuelos y crêpes."
204;"¿Los alimentos cocidos en microondas pueden consumirse inmediatamente?";"No. Es necesario esperar unos minutos, porque aún después de ser retirados del microondas, los alimentos siguen cocinándose durante un tiempo, por conducción del calor. Recuerde que a mayor tiempo de cocción, mayor debe ser el tiempo de reposo. Las carnes, por ejemplo, requieren entre diez y quince minutos de ""descanso""."
205;"¿Qué vajilla debe usarse para cocinar en micorondas?";"Lo ideal son los recipientes de vidrio, porcelana, cerámica, papel y algunos plásticos, pues no rechazan las microondas. Nunca utilice vajilla de melanina o barro, ni con precintos metálicos o decoraciones en pintura metálica. Verifique, además, que los recipientes de plástico o las bolsas sean termoresistentes y aptas para este tipo de cocción. De lo contrario, impedirán que las microondas pasen y su rebote puede producir chispas o demorar gratuitamente el tiempo de cocción."
206;"¿Cómo se conservan mejor las galletitas?";"Cuando conserve galletas y bizcochos de diferentes clases no conviene guardarlos en la misma lata, porque esto hace que se deterioren con mayor rapidez."
207;"¿Cómo cocinar bien las omelettes?";"Para que la tortilla u omelette se cocine parejo espere a que los bordes hayan cuajado un poco y recién entonces despéguela con la ayuda de una espátula de madera. Esto permitirá que cuaje el resto de la tortilla."
208;"¿Cuál es la mejor forma para picar hongos/setas?";"Para picar o trocear fácilmente hongos/setas es necesario utilizar dos cuchillos, de igual tamaño, sujetando ambos mangos, juntos, con una mano y las puntas de las hojas con la otra."
209;"¿Hay que lavar las lentejas secas?";"Las lentejas se deben lavar en abundante agua fría y hay que desechar las que flotan, pues están pasadas."
210;"¿Cómo aprovechar el arroz muy cocido?";"Si el arroz hervido se ha pasado ligeramente añádale unos gotas de limón y revuélvalo suavemente para que vuelva a quedar suelto."
212;"¿Cómo se decora con mejillones y langostinos?";"Para decorar los mejillones deben quedar con una sola valva y los langostinos con cabeza y cola."
213;"¿Cómo se hace la pasta de ajo?";"Para obtener pasta la pasta es necesario asar u hornear la cabeza entera, con piel, hasta que esté bien dorada, y luego se pisa."
214;"¿Qué hay que tener en cuenta cuando se preparan camarones/camarón o langostinos ya cocidos?";"Cuando se utilizan camarones ya cocidos no es aconsejable someterlos nuevamente a cocción junto con los otros ingredientes, pues se tornan duros, basta con remojarlos en caldo de verduras y añadirlos a final."
215;"¿Qué hay que saber cuando se utiliza pescado congelado?";"El pescado congelado no requiere ser lavado ni salado."
216;"¿Cómo se retiran con facilidad las espinas de un pescado?";"Las espinas de pescado se pueden retirar con facilidad si previamente se lo introduce en agua hirviendo."
217;"¿Qué hay que tener en cuenta cuando se va a flambear?";"Para flambear la preparación debe estar muy caliente, sin humedad y el recipiente bien seco, sólo con grasa y jugo de cocción."
218;"¿Cómo pueden hacerse refrescos caseros?";"Para hacer en casa unos buenos refrescos utilice las cáscaras de cítricos que no hayan recibido pesticidas. Hiérvalas con 300 gramos de azúcar y un litro de agua durante media hora. Retire del fuego, deje enfriar, cuele y añada otro litro de agua o soda, pero esta vez bien fría. Reserve en la heladera hasta el momento de su consumo."
219;"¿Qué precauciones hay que tomar al hacer merengue?";"Antes de batir el merengue, asegúrese de que las paletas batidoras estén bien limpias y secas, sin restos de yema o materias grasas."
220;"¿Cómo lograr un merengue bien alto?";"Para que el merengue levante más durante su cocción, conviene ponerlo antes, crudo, en la heladera. Un buen rato en el frío impedirá que se achate o pierda volumen."
221;"¿Cuál es la temperatura ideal para derretir el chocolate cobertura?";"El baño María donde se coloca el recipiente con el chocolate cobertura nunca debe llegar a hervir y la temperatura del chocolate no debe superar los 46°C, para el negro, y los 43°C, para el blanco o con leche."
222;"¿Cómo picar o cortar la fruta abrillantada?";"Para picar la fruta abrillantada o las frutas disecadas como damascos y duraznos (orejones) emplee una tijera de cocina o cuchillo previamente mojados para evitar que el azúcar no se adhiera."
224;"¿Es conveniente consumir recién hechas las tortas con frutas secas y abrillantadas ?";"Las tortas de frutas secas y abrillandas tienen mejor sabor si se conservan herméticamente envueltas por varios meses antes de consumirlas."
225;"¿Qué significa en repostería aceite neutro?";"Cuando, en una receta, se indica aceite neutro significa que se debe utilizar aceites que no tengan sabores fuertes, por lo tanto el de oliva y el de uva deben descartarse."
226;"¿Cómo aumentar la cantidad de manteca?";"Una solución simple cuando no se tiene cantidad suficiente de manteca para la elaboración de una receta es incorporarle igual cantidad de leche y batir bien hasta que quede todo bien integrado. El volumen se duplicará."
227;"¿Cómo saber cuando un melón está a punto?";"A la hora de elegir un melón juzgue su madurez por su peso, por la impresión de flexibilidad en sus extremos y por su perfume. Si lo deja a temperatura ambiente se conserva algunos días, mientras que en la heladera es posible conservarlo hasta dos semanas."
228;"¿Cómo se pueden utilizar las semillas de girasol?";"Las semillas de girasol tostadas otorgan un toque distinto a la ensalada de hojas verdes"
229;"¿Se pueden guardar las papas peladas?";"Por supuesto. Si le sobraron papas peladas puede conservarlas en la heladera. Para eso, primero lávelas, luego séquelas con un repasador y póngalas dentro de una bolsa de polietileno húmeda y perforada, para que el frío las conserve blancas."
230;"¿Cómo obtener papas fritas más sabrosas?";"Para que las papas fritas queden bien doradas y crocantes déjelas, una vez cortadas, durante diez minutos sumergidas en un bol con agua y una cucharada de sal gruesa. Luego escúrralas, séquelas bien con un repasador limpio y fríalas enseguida."
231;"Hay que esperan que se enfríen los ingredientes de una ensalada para condimentarla?";"Las ensaladas con ingredientes cocidos, como las papas,remolachas, etc., se aderezan cuando aún están calientes, pues se impregnan mejor."
232;"¿Cuándo se deben añadir el eneldo, la albahaca o la menta a una preparación?";"El sabor del eneldo, la albahaca y la menta disminuye cuando son sometidas al calor, por lo tanto es preferible añadirlas al final de la cocción."
233;"¿Cuánto demora la cocción de un pato?";"¿Cuánto demora la cocción de un pato? 
Para saberlo, calcule treinta minutos de horno por cada 450 gramos de carne, a fuego medio."
234;"¿Cómo se distinguen las cebollas frescas?";"Las cebollas, cuando son frescas, tiene forma regular y la cáscara adherida."
235;"¿Qué hacer para que las manzanas horneadas no se desarmen?";"Para que las manzanas asadas no se desarmen durante la cocción, antes de hornearlas se les hace una incisión, sólo en la piel, que cubra el contorno."
236;"¿Cómo se condimenta correctamente el pollo?";"Para condimentar un pollo se recomienda colocar las hierbas aromáticas, rodajas de limón o la salsa que se decida emplear, entre la piel y la carne del ave."
237;"¿Cómo hay que conservar las frutas secas?";"Para mantener la calidad de las frutas secas es necesario incorporar un trozo de cáscara fresca de naranja o de limón al tarro en el que se guardan. De este modo se conservarán con la humedad justa, dado que la cáscara absorbe el exceso de aire que podría resecarlas."
239;"¿Cómo se conservan las paltas?";"Lo ideal es no dejar remanente, pero en caso de que necesite guardar media palta hágalo con su carozo y pinte su superficie con aceite o manteca. Esto hará que no se deteriore tan rápidamente."
240;"¿Cómo se conservan los limones?";"Los limones se conservan un mes en la heladera, guardados en un recipiente cerrado con agua en su interior."
241;"¿Cómo debe conservarse el cacao?";"El cacao debe conservarse en un recipiente herméticamente cerrado, pues absorbe fácilmente la humedad."
